,Unnamed: 0,text,favourite_count,retweet_count,created_at
0,0,camera body fujifilm x,0,0,2022-04-21 03:29:31+00:00
1,1,untitled korea snap photography,0,1,2022-04-21 02:13:53+00:00
2,2,snap one mentioned wallstreetbets last hours via snap,0,0,2022-04-21 02:13:37+00:00
3,3,anyone trade stuff snapchat horny haha dm jakol snap,9,0,2022-04-21 01:55:14+00:00
4,4,sna price moved day moving average april view odds indicators,0,0,2022-04-21 01:31:11+00:00
5,5,age stop creating new social media accounts trade facebook snap tiktok,2,0,2022-04-21 01:08:33+00:00
6,6,rockin canyons angeles landing zion utah photography travelphotography explorepage snap,0,0,2022-04-21 00:55:42+00:00
7,7,amen key call center metrics watch call answer abandon rates avg time,1,0,2022-04-21 00:05:59+00:00
8,8,someone say extra cheese pizza snap snapcustompizza pizzalovers cheesepizza,0,0,2022-04-21 00:00:47+00:00
9,9,hey babe daddy really horny rn come dm add snapchat nathandeloroy dont make wait dm horny snap,0,0,2022-04-20 23:54:58+00:00
10,10,times square poppin always love atmosphere concrete jungle new york new york photography,1,0,2022-04-20 23:45:27+00:00
11,11,alicechildren families face rising food prices often locked supports address,0,0,2022-04-20 23:15:02+00:00
12,12,illegal chopoff dogs tail could potentially snap diesels tail,0,0,2022-04-20 23:04:42+00:00
13,13,insidersale ticker snap price name andersen derek quantity value,0,0,2022-04-20 23:01:15+00:00
14,14,snap gorman jeremi sold shares class common stock worth transaction,0,0,2022-04-20 23:01:02+00:00
15,15,dewine ohio governor amp administration still owe thousands back pay people needed unemployment,0,0,2022-04-20 22:59:02+00:00
16,16,horny girls add snapchat geil snap guys,0,0,2022-04-20 22:11:37+00:00
17,17,k fans please add snap blasian mf bitmoji scan made eyes like banana fr,0,0,2022-04-20 21:59:28+00:00
18,18,damn b musty mama broke confessed got romanced chatbot oh snap,0,0,2022-04-20 21:46:26+00:00
19,19,everyone snap,3,0,2022-04-20 21:46:15+00:00
20,20,earlier better text snapchat account hack guaranteed snap snapchat snapch snapchatdown xgems,0,0,2022-04-20 21:25:06+00:00
21,21,use snap ebt select one time purchase shipped sold amazon purchased w ebt item available f,0,0,2022-04-20 21:13:07+00:00
22,22,use snap ebt select one time purchase shipped sold amazon purchased w ebt item available f,0,0,2022-04-20 21:10:57+00:00
23,23,makes thigns easier snap ubuntu,25,8,2022-04-20 21:07:14+00:00
24,24,let us help secure job pays well provides opportunity increase earnings helpnm,0,0,2022-04-20 21:05:31+00:00
25,25,use snap ebt select one time purchase shipped sold amazon purchased w ebt item available f,0,0,2022-04-20 21:05:02+00:00
26,26,use snap ebt select one time purchase shipped sold amazon purchased w ebt item available f,0,0,2022-04-20 21:02:44+00:00
27,27,mobile app download snap amp translate iphone,0,0,2022-04-20 21:00:00+00:00
28,28,use snap ebt select one time purchase shipped sold amazon purchased w ebt item available f,0,0,2022-04-20 20:57:58+00:00
29,29,use snap ebt select one time purchase shipped sold amazon purchased w ebt item available f,0,0,2022-04-20 20:54:52+00:00
30,30,use snap ebt select one time purchase shipped sold amazon purchased w ebt item available f,1,1,2022-04-20 20:47:49+00:00
31,31,use snap ebt select one time purchase shipped sold amazon purchased w ebt item available f,0,0,2022-04-20 20:45:27+00:00
32,32,use snap ebt select one time purchase shipped sold amazon purchased w ebt item available f,0,0,2022-04-20 20:44:30+00:00
33,33,use snap ebt select one time purchase shipped sold amazon purchased w ebt item available f,0,0,2022-04-20 20:41:17+00:00
34,34,feel free hacking easy text snapchat account hack guaranteed snap snapchat snapchatleak snapchatsupport snapchatdown,0,0,2022-04-20 20:08:38+00:00
35,35,earlier better text snapchat account hack guaranteed snap snapchat snapchatleak,0,0,2022-04-20 20:07:15+00:00
36,36,account hack wallet hack tiktok instagram facebook bitcoin coinbase available want hack text,0,0,2022-04-20 20:05:48+00:00
37,37,join saturday hartford keney park earth community event information,1,1,2022-04-20 20:05:02+00:00
38,38,snapchat twitter instagram facebook whatsapp text snapchat account hack guaranteed snap snapchat,0,0,2022-04-20 20:03:54+00:00
39,39,talented omg definitely top snap,1,0,2022-04-20 20:03:32+00:00
40,40,soon notice hack account text snapchat account hack guaranteed snap snapchat,0,0,2022-04-20 20:03:08+00:00
41,41,bit overcast financial district new york city still awesome new york new york,5,1,2022-04-20 19:58:21+00:00
42,42,grateful shared stories story missed sooner highlights gend,1,2,2022-04-20 19:40:29+00:00
43,43,wish salad plate looked like buy produce directly local farmers blaisdell farm,2,2,2022-04-20 19:29:59+00:00
44,44,armenia chosen entry eurovision song snap song life affirm,3,0,2022-04-20 19:20:18+00:00
45,45,emergency snap benefits ending hunger cliff looms via,1,0,2022-04-20 19:12:41+00:00
46,46,slide photography monochrome blackandwhitephotography snap,26,1,2022-04-20 18:56:40+00:00
47,47,sangree netflix paypal snap meta amc wix roku snow nflx nio pypl snap fb wix roku snow,1,0,2022-04-20 18:42:05+00:00
48,48,time upgrade signage company branding talk snap today next generation signage,0,0,2022-04-20 18:12:29+00:00
49,49,mobile app download snap amp translate iphone,0,0,2022-04-20 18:00:00+00:00
50,50,fyi call bitch nothing term endearment warning could snap,0,0,2022-04-20 17:57:47+00:00
51,51,accepting supplemental nutrition assistance program snap benefits meijer pickup home,0,0,2022-04-20 17:53:17+00:00
52,52,nineteen data sources determine eligibility one tools administrators snap program use p,3,2,2022-04-20 17:39:09+00:00
53,53,found pics umbrellaacademy aidangallagher trend viral aidansarmy handsomeboy teenagerheartthrob,1,0,2022-04-20 17:14:18+00:00
54,54,high horny buyingcontent snap meets,50,0,2022-04-20 16:40:10+00:00
55,55,watch fuck fleshlight creampie snap vidcall snap sitherjizz horny dm nsfwtwt snap bwc,12,0,2022-04-20 16:35:37+00:00
56,56,snap snap chart,0,0,2022-04-20 16:30:34+00:00
57,57,add snap nikkikole fun adulttime playwithme snap videos,0,1,2022-04-20 16:25:16+00:00
58,58,subscribe amp save use snap ebt select one time purchase shipped sold amazon purchased w,0,0,2022-04-20 16:25:10+00:00
59,59,black cast glitter sprinkles life complete lifegoals snap,1,0,2022-04-20 16:04:04+00:00
60,60,reshare two thirds participants snap families kids although eligible people rece,3,0,2022-04-20 16:01:41+00:00
61,61,advocacy action bfb signed support protecting immigrant families pif public comments applauding pro,2,0,2022-04-20 16:01:29+00:00
62,62,anyone else snap buggin mine keeps changing ppls names old names like wtf snapchatdown snap snapchat,5,0,2022-04-20 15:41:38+00:00
63,63,power snap uk charts apr smusic music snap,0,0,2022-04-20 15:30:43+00:00
64,64,reduce barriers people accessing nutrition programs like snap wic also working prom,0,0,2022-04-20 15:26:58+00:00
65,65,according percent food banks reported increase food assistance demand,1,7,2022-04-20 15:26:34+00:00
66,66,untitled korea snap photography,1,0,2022-04-20 15:13:17+00:00
67,67,use snap ebt select one time purchase shipped sold amazon purchased w ebt item available f,0,0,2022-04-20 14:58:50+00:00
68,68,use snap ebt select one time purchase shipped sold amazon purchased w ebt item available f,0,0,2022-04-20 14:55:04+00:00
69,69,nyse stocks watch bankofamerica bac buy snap snap sell nokia nok buy att inc sell,0,0,2022-04-20 14:42:08+00:00
70,70,use snap ebt select one time purchase shipped sold amazon purchased w ebt item available f,0,0,2022-04-20 14:35:39+00:00
71,71,maryland washington county every appalachian adults struggle perform basic math res,0,0,2022-04-20 14:02:29+00:00
72,72,snap provides monthly benefits use buy food grocery stores farmers markets nutrition,0,0,2022-04-20 14:01:48+00:00
73,73,snap ar vision spectacles whole lot metaverse ar vr virtualreality augmentedreality,1,0,2022-04-20 13:47:22+00:00
74,74,idea bed sheets snap,0,0,2022-04-20 13:38:12+00:00
75,75,add selling rn buyingccontent royalehightrade sellingcontent cashapp secretseller snap,5,0,2022-04-20 13:23:02+00:00
76,76,snap ar vision spectacles whole lot,0,0,2022-04-20 13:19:26+00:00
77,77,get usa sharktank prank fuelshortage survivor summer wednesdaythought,0,0,2022-04-20 13:06:23+00:00
78,78,look goofy mama broke confessed licked cheek oh snap,0,0,2022-04-20 12:51:22+00:00
79,79,sell content cash payment upfront anyones interested sellingcontent buyingcontent snap selling,6,0,2022-04-20 12:26:07+00:00
80,80,new research understanding snap recipient characteristics guide,0,0,2022-04-20 12:12:29+00:00
81,81,say near hr due demand say due sui snap ctc free healthcare works,0,0,2022-04-20 12:07:34+00:00
82,82,photo photography snap,27,0,2022-04-20 12:00:44+00:00
83,83,feel free hacking easy text snapchat account hack guaranteed snap snapchat snapchatleak snapchatsupport snapchatdown,0,0,2022-04-20 11:56:35+00:00
84,84,snap market top winner yesterday jumping snap stockmarket stock,0,0,2022-04-20 11:56:08+00:00
85,85,automate right system testing snap snap decreases time spent test cases preparation,0,1,2022-04-20 11:50:35+00:00
86,86,c freeshipping sale sales amp x ft synthetic winch rope kit anxingo,0,0,2022-04-20 11:39:10+00:00
87,87,reebok florida panthers structured adjustable snap back hat osfa vg z reebok florida,0,0,2022-04-20 11:30:18+00:00
88,88,traffic congestion macau sony sonyalpha fe g snap streetphotography cityscape macaulife,0,0,2022-04-20 11:28:40+00:00
89,89,power snap uk charts apr smusic music snap,0,0,2022-04-20 11:23:23+00:00
90,90,snap day moving average crossed day moving average april view odds oth,0,0,2022-04-20 10:46:37+00:00
91,91,feel free hacking easy text snapchat account hack guaranteed snap snapchat snapchatleak snapchatsupport snapchatdown,0,0,2022-04-20 10:26:47+00:00
92,92,available hacking services hack coinbase hacking bitcoin earlier better text,0,0,2022-04-20 10:24:43+00:00
93,93,want hack text snapchat account hack guaranteed snap snapchat snapchatleak snapchatsupport,0,0,2022-04-20 10:23:58+00:00
94,94,snapchat twitter instagram facebook whatsapp text snapchat account hack guaranteed snap,0,0,2022-04-20 10:22:07+00:00
95,95,soon notice hack account text snapchat account hack guaranteed snap snapchat,0,0,2022-04-20 10:21:26+00:00
96,96,photography themed badges photography photographer creative snap pic image badges,0,0,2022-04-20 10:18:04+00:00
97,97,untitled korea snap photography,0,0,2022-04-20 10:13:46+00:00
98,98,word around way uppity mama got hair tongue oh snap,0,0,2022-04-20 09:45:48+00:00
99,99,citigroup changes recommendation hold buy snap inc snap raises price target,0,1,2022-04-20 09:39:43+00:00
100,100,haf knowsley snap,0,0,2022-04-20 09:39:11+00:00
101,101,shout hosting bit amindful mind mastery week part haf easter,1,0,2022-04-20 09:23:11+00:00
102,102,remove snap apps amp block ubuntu ubuntu snap,0,0,2022-04-20 09:13:20+00:00
103,103,time upgrade signage company branding talk snap mayo today next gen,0,0,2022-04-20 09:03:11+00:00
104,104,time upgrade signage company branding talk snap today next generation signage,1,0,2022-04-20 08:28:53+00:00
105,105,untitled korea snap photography,0,0,2022-04-20 08:13:58+00:00
106,106,snapchat launches new ar art experiences encourage cultural engagement snap continue,0,0,2022-04-20 08:00:17+00:00
107,107,oh snap bougie mum hooked fishin hook reel frozen food section ouch,0,0,2022-04-20 07:46:12+00:00
108,108,stay snap long user revenue growth augmentedreality amp mixedreality track record hardware ex,3,0,2022-04-20 07:43:36+00:00
109,109,snap staking live stake snap earn snap go choose,18,13,2022-04-20 07:34:52+00:00
110,110,happy everyone pls excuse dramatically dramatic expression undramatic bmw cannot believe,1,0,2022-04-20 07:21:17+00:00
111,111,elect governor ban sugar poisonous foods schoollunches allow sold,0,0,2022-04-20 06:53:24+00:00
112,112,mailonline tests snap augmented reality spectacles via augmentedreality ar metaverse snap,2,0,2022-04-20 06:37:55+00:00
113,113,snapchat twitter instagram facebook whatsapp text snapchat account hack guaranteed snap,0,0,2022-04-20 06:15:31+00:00
114,114,soon notice hack account text snapchat account hack guaranteed snap snapchat,0,0,2022-04-20 06:15:03+00:00
115,115,mcavoy scores ot bruins snap blues game win streak cbs boston news today mcavoy scores bruins snap,1,0,2022-04-20 05:23:30+00:00
116,116,untitled korea snap photography,2,0,2022-04-20 05:13:11+00:00
117,117,snapchat twitter instagram facebook whatsapp text snapchat account hack guaranteed snap,0,0,2022-04-20 05:03:46+00:00
118,118,add snapchat username iamkaranbachani watch videos even snapchat snap snapchat,0,0,2022-04-20 05:00:39+00:00
119,119,camera body fujifilm x,0,0,2022-04-20 04:45:28+00:00
120,120,immigrationlaw broken illegals shameless wanna come usa,0,0,2022-04-20 04:41:51+00:00
121,121,add snap message snap comment interested snap nsfwtwt sellingcontent nsfwtwt,3,0,2022-04-20 03:40:23+00:00
122,122,us goverment exchange us citizens technology give away people food think us,0,0,2022-04-20 03:29:27+00:00
123,123,someone somewhere halfd snap,19,0,2022-04-20 03:25:02+00:00
124,124,also imagine blue chip stocks nose diving fb sq snap netflix would want hedge f,2,0,2022-04-20 01:49:04+00:00
125,125,oh snap bougie mama got wooden legs real feet bam nasty,0,0,2022-04-20 01:47:13+00:00
126,126,untitled korea snap photography,1,0,2022-04-20 01:13:39+00:00
127,127,sna enters uptrend momentum indicator exceeded level april view odds,0,0,2022-04-20 00:33:13+00:00
128,128,anyone wants talk snap add snapchat snap friends,1,0,2022-04-19 23:54:42+00:00
